sentence,A1
La réaction de floculation peut présenter diverses modalités dans le dosage de l'antitoxine diphtérique .,0
"Telle, étourdie par la gaieté des fidèles, ivre de camaraderie, de médisance et d'assentiment, Mme Verdurin, juchée sur son perchoir, pareille à un oiseau dont on eût trempé le colifichet dans du vin chaud, sanglotait d'amabilité.",0
"Ceci pourrait donner lieu à des jeux interactifs, qui sont un excellent moyen de mémorisation.",0
"Et cette joie ancienne m'apportant la connaissance de ma présente misère, une route bossuée qui pique une tête dans un creux où elle éparpille quelque cases ; une route infatigable qui charge à fond de train un morne en haut duquel elle s'enlise brutalement dans une mare de maisons pataudes, une route follement montant, témérairement descendante, et la carcasse de bois comiquement juchée sur de minuscules pattes de ciment que j'appelle ""notre maison"", sa coiffure de tôle ondulant au soleil comme un peau qui sèche, la salle à manger, le plancher grossier où luisent de têtes de clous, les solives de sapin et d'ombre qui courent au plafond, les chaises de paille fantomales, la lumière grise de la lampe, celle vernissée et rapide des cancrelats qui bourdonne à faire mal .",0
Elle ne travaille pas,1
C'était très intéressant,0
"Ils s'engouffraient dans les sentiers, puis se ruaient sur les arbres et tiraient sur leurs branches.",0
"Même si on adore un livre, il faut, je pense, accepter que certains passages du livre soient coupés ou modifiés, car le travail d'écriture est complètement différent du travail d'adaptation cinématographique.",0
"La société SpaceX conçoit, construit et commercialise les lanceurs Falcon 9, les moteurs Merlin qui les propulsent ainsi que le vaisseau cargo Dragon et sa version habitée, le Crew Dragon.",0
Des parents qui n'arrivent pas à exercer pleinement leur autorité.,0
"Selon l'auteur, les tests actuels encouragent les élèves à développer une pensée personnelle.",0
"Il en résulte alors des conséquences désastreuses pour certaines espèces ; pour le cerf, on parle d'une malformation de la mâchoire, d'une masse corporelle limitée, d'organes sous-dimensionnés et d'une vie sexuée réduite.",0
"Et il faut construire les marionnettes, faire les costumes, faire les décors, faire la mise en scène, faire les enregistrements.",0
"Chez les gros utilisateurs, cette communication comblerait un ""vide existentiel"" et contrecarrerait une vie sociale ""réelle"" insatisfaisante.",0
"Parfois, cette épreuve se passe mal, entre autonomie et dépendance, entre succès et échecs.",0
"En plus de son rôle, si important pour la recherche en génétique et en biologie moléculaire, de ""pourvoyeur"" de quantité illimitée d'ADN à partir d'un infime échantillon, la PCR s'avérera un outil indispensable notamment au diagnostic de plusieurs maladies et à la génétique forensique.",0
"Elle génère donc un espace où se manifestent des modes d'expression très divers, en fonction des projets de séances qui présentent plus ou moins d'improvisation ou de mise en forme ainsi qu'en fonction de la variabilité et de la composition des groupes.",0
"Cependant dans certains cas, les exploitants veulent rentabiliser leur concession au maximum et dans des délais beaucoup trop courts d'un point de vue écologique.",0
On mange à 20 Heures ou plus tard,1
"Laurine courait maintenant, s'abandonnait tout à fait au plaisir de ce jeu nouveau et, la figure rose, elle se précipitait d'un grand élan d'enfant ravie, à chacune des fuites, à chacune des ruses, à chacune des feintes de son compagnon.",0
"Catherine Nave-Bekhti, secrétaire générale du Sgen-CFDT , juge cette nouvelle interdiction inutile.",0
Eviter d'importer de l'inflation et surtout contrôler le niveau de change du franc suisse par rapport aux grandes devises internationales et notamment face à l'euro et au dollar.,0
"Quoique brève, notre entrevue a été productive.",0
Il y a essentiellement trois grandes catégories.,0
Il a les yeux marron.,1
Je suis allé la voir dès que j'ai appris qu'elle avait des problèmes.,0
"Le matin où, à la suite d'une orgie, il se trouva décidément volé, il acheta deux beaux chevaux, prit pour domestique un ancien soldat palefrenier du maquignon, et, dans son mépris pour les jeunes Parisiens beaux parleurs, partit pour l'armée.",0
Nous devons nous envisager autant comme citoyens du monde que comme héritiers d'une vieille nation.,0
Elle a 21 ans,1
"De plus, ce dernier doit apprendre à bien tenir son chien pour permettre à l'animal de bien le conduire.",0
Conservation ou exploitation ?,0
"En entendant la porte d'entrée s'ouvrir, elle leva les yeux de l'ordinateur et aperçut son mari.",0
"Les industriels ont entrepris des recherches pour améliorer les procédés de fabrication, les rendre moins énergivores et limiter les déchets à la source, mais la question des matériaux déjà existants se pose aujourd'hui, bien que les besoins ne soient pas immédiats.",0
Je suis né à Toronto.,1
"Dans cette série TV (connue pour inspirer les geeks de tout âge et toute nationalité), le holodeck est une espèce de salle de jeu capable de matérialiser n'importe quel environnement, apparemment sans nécessiter aucune interface particulière.",0
J'ai détesté la littérature à l'école en plus de ça,0
"De plus, certaines limitations sont également apparues, en termes de puissance ou bien de permis de conduire.",0
J'habite à Paris.,1
Je suis papa.,1
Le bulletin de notes du gouvernement a piètre allure.,0
J'aime beaucoup cette exposition.,1
"Toutes ses velléités de dénigrement s'évanouissaient sous la poésie du rôle qui l'envahissait, et, entraînée vers l'homme par l'illusion du personnage, elle tâcha de se figurer sa vie, cette vie rétentissante, extraordinaire, splendide, et qu'elle aurait pu mener cependant, si le hasard l'avait voulu.",0
Gros bisous et merci beaucoup pour cette nouvelle histoire.,0
"Suite à une série de retards, cet employé a été mis à pied pour une durée indertéminée",0
"Ils vont habiter tous les deux dans un joli appartement, à Paris.",0
"Aussitôt que vous eûtes résolu ce problème, vous partîtes.",0
Le public n'a pas reconnu son talent.,0
Et la grande personne était bien contente de connaître un homme aussi raisonnable.,0
Mais il y a un problème .,1
"""Malheureusement, on voit souvent la capacité à parler anglais comme une force, mais pas forcément d'autres langues, regrette Madame.",0
Les linguistes estiment qu'un idiome ne peut survivre qu'à condition de compter au moins 100 000 locuteurs.,0
Les éternels affrontements entre ceux qui militent pour la protection inconditionnelle de sanctuaires naturels et ceux qui défendent les intérêts économiques des compagnies forestières semblent même passés de mode.,0
"Occasionnellement, Kassák ment sur ses intentions, sa profession ou sa confession ; il se dit ainsi juif pour bénéficier d'une caisse d'entraide juive (autre réseau élaboré à l'échelle européenne) et manque de se faire démasquer lorsqu'il tient son livre de prières à l'envers ou peine à retenir les quelques lignes de prière apprises phonétiquement.",0
"C'est peut-être une petite soeur, un gentil chat comme moi .",1
"Au-delà de la pression réglementaire, les entreprises qui s'engagent dans le recyclage des déchets professionnels s'inquiètent de la diminution des matières premières qui entrent dans la composition de ces appareils : des métaux rares, du cuivre, du fer.",0
"Ils permirent ainsi, pour le meilleur et pour le pire, cette ""grande transformation"" qui multiplia les productions et autorisa l'augmentation colossale de l'espèce humaine.",0
C'est vraiment dommage que les gens ne fasse pas attention à ce qu'ils consomment,0
"Nous parlons français lorsque nous sommes dehors, à l'école ou au marché",1
Ils rentrèrent au pays après qu'ils eurent vécu en Europe,0
Ils n'ont tout simplement aucune classe.,0
"C'est à la fin du XIXe siècle que les scientifiques commencent à s'intéresser, de manière raisonnée , aux capacités intellectuelles des hommes et des femmes.",0
"En me levant ce matin, j'avais très mal à la tête.",0
J'adore l'odeur du napalm au petit matin.,0
"Comme un rappel du massacre des quelque 60 millions de bisons orchestré à la fin du XIXe siècle pour venir à bout des ""PeauxRouges"".",0
"TED, ce sont des conférences au cours desquelles les intervenants doivent parler pendant 20 minutes sans notes.",0
"Déplorant que le Sénat ait préféré, au contraire, en rester aux dispositions initiales du projet de loi, il a conclu en constatant qu'il semblait, dans ces conditions, difficile de trouver une conciliation permettant d'aboutir à un accord en commission mixte paritaire.",0
"À cette occasion, les parents cachent des oeufs en chocolat dans la maison et le jardin, et les enfants s'amusent à les chercher.",0
On a droit à tout sauf à la qualité.,0
Tout est prêt.,1
Ma contrainte avec lui eut une grande influence sur mon caractère.,0
"En Allemagne, l'université de Potsdam donne aux réfugiés qui ont été enseignants dans leur pays d'origine, la possibilité de devenir assistants puis professeurs dans les écoles allemandes qui manquent d'enseignants.",0
"Tout le chapelet de sociétés effectivement connectées, dont l'Antiquité méditerranéenne puis l'Europe médiévale ne formaient que l'extrémité occidentale, ne peut plus apparaître uniquement comme un ensemble d'anciennes civilisations plus ou moins rétives à la modernité, objets de l'orientalisme.",0
C'est dans cette voie - ouverte entre la timidité aristotélicienne et l'audace insensée des alchimistes - qu'allait passer toute la science de l'avenir.,0
"Malgré les progrès accomplis, la situation alimentaire mondiale reste donc préoccupante, surtout si on la met en relation avec les données démographiques.",0
"Comme sa valise est trop petite, il demande à Hélène si elle veut toujours bien lui en prêter une : il peut venir la chercher chez elle puisqu'ils n'habitent pas loin l'un de l'autre.",0
"La vapeur se contournait en spirales autour des groupes de palmiers, entre lesquels apparaissaient de pittoresques bungalows.",0
"Le jardin est long et étroit, il y a une balançoire au fond et un barbecue, proche de la terrasse, sur laquelle est posée un transat",0
"Le bus est certes très pratique, mais très dépendant de la qualité du trafic.",0
"Notre charrette avait franchi le sommet d'un autre monticule ; en face de nous s'étalait l'immense étendue de la lande, semée de rocs et de rochers.",0
J'ajoute que vous êtes aussi fondatrice d'une association : Inversons la classe.,0
Il faut bien faire attention à ses vêtements et à sa coiffure,0
"Ne trouves-tu pas que ces vieux murs noircis, symboles maintenant et autrefois moyens du despotisme, sont une véritable image du triste hiver ?",0
"Parallèlement à l'urbanisation et à la déchristianisation de la société française, le septième jour, libéré de ces contraintes, est entré dans l'ère du temps libre.",0
Je suis vraiment content que tu aies pu venir.,0
"L'ordre de grandeur pour le moment, par exemple pour l'Afrique est environ 350 milliards d'euros de dette à l'égard de ses créanciers.",0
"Il s'est également arrêté dans une boulangerie où il a longuement hésité entre un pain au chocolat, un croissant, et une brioche aux pralines, pâtisserie typiquement lyonnaise",0
C'est une excellente idée !,0
Ellénore gardait le silence.,0
Il interroge surtout la prétendue affinité élective de celle-ci avec le seul monothéisme.,0
Je me suis creusé la tête sans relache durant des heures pour résoudre ce casse-tête chinois.,0
"Dans le désert, tous les hommes n'ont pas la peau noire.",0
"A cette occasion, les enfants offrent des cadeaux à leur mère mais aussi de jolis oeillets.",0
"À partir de récits de vie, elles dissèquent les motivations des candidats à la reconversion professionnelle.",0
J'ai mangé un hamburger et des frites.,1
Ce petit nombre est notamment dû à ses expérimentations constantes et parfois désastreuses de nouvelles techniques.,0
"J'ai ensuite beaucoup pratiqué, grâce à mon addiction à internet",0
"Je passai quelques heures à ses pieds, me proclamant le plus heureux des hommes, lui prodiguant mille assurances de tendresse, de dévouement et de respect éternel.",0
Il est alors témoin d'un spectacle étonnant.,0
"Les enfants grands sont maudits par les dieux, c'est le vieux Zahor qui l'a dit.",0
Est-ce qu'il y a des devoirs?,1
Qu'est-ce que vous faites le samedi et le dimanche ?,1
"Globalement, presque une personne sur cinq (18, 9%) vit dans un ménage avec au moins un type d'arriéré de paiement et 10, 0% avec au moins deux types d'arriérés de paiement, le pourcentage de la population avec un ou deux types d'arriérés de paiement dimunant avec l'âge, le niveau de formation et les revenus.",0
"Ils avaient auparavant reçu une lettre d'une veuve qui, après avoir consacré sa vie à élever seule ses enfants, ne recevait leurs visites qu'en de très rares occasions.",0
"Je fais mon lit tous les jours, bien sûr; et je fais souvent la vaisselle.",0
Il n'y a presque pas de pollution,0
s'écriait-elle en saisissant les mains de Fabrice.,0
"Serveur : une table pour quatre, n'est-ce pas ?",0
"Pour éviter un oubli, vous pouvez consulter le ""Guide des formalités"" en ligne.",0
"Un jour qu'il était venu nous voir à Paris après dîner en s'excusant d'être en habit, Françoise ayant, après son départ, dit tenir du cocher qu'il avait dîné ""chez une princesse"", - ""Oui, chez une princesse du demi-monde !"" avait répondu ma tante en haussant les épaules sans lever les yeux de sur son tricot, avec une ironie sereine.",0
"S'il fait beau, l'après-midi vous pouvez aller au jardin du Luxembourg et, le soir vous pouvez faire un tour en bateau jusqu'à la Tour Eiffel.",1
Elle a beaucoup de mal à avancer dans la neige.,0
"Le récit s'ordonne par l'accumulation de saynètes, procédé qui donne une tonalité picaresque au parcours, mais qui participe aussi à ancrer les souvenirs d'une mobilité dans des lieux, ne seraient-ils que de passage.",0
"Au village, il y a les pour et les contre.",0
L'employeur a en effet déjà obligation de prendre en charge la moitié de l'abonnement aux transports en commun de ses salariés.,0
Elle a 84 ans et elle habite à Antibes,1
Les femmes sont sous-représentées dans le domaine des sciences.,0
"Bonjour, je vous appelle au sujet de mon imprimante photo.",1
""" à ses proches",0
"Il ne change pas facilement d'avis, il est têtu.",0
Le rythme d'extinction des langues a ainsi atteint des proportions sans précédent dans l'histoire : 10 par an à l'échelle mondiale.,0
"Plusieurs études ont démontré que l'écobilan des modules photovoltaïques (énergie grise. Émission du gaz à effet de serre.) est relativement positif, comparé à d'autres filières de production d'énergie.",0
Ce dépassement rétroactif de la Renaissance européenne a pour conséquence l'abandon du modèle évolutionniste linéaire tel que l'Europe des Lumières puis le positivisme du XIXe siècle l'avaient formalisé.,0
"Clara a bu de l'eau, son frère a bu un verre de vin",1
"Il y a une ruée vers : ""devenons un peu plus indépendants, moins dépendants des magasins, de l'importation, des grandes surfaces"", donc une espèce de retour au savoir-faire artisan, un peu de nos ancêtres, de nos parents, de nos grands-parents.",0
Il s'agit d'un projet pour la paix de notre temps.,0
"Tout comme les comportements des animaux sont déterminés par l'instinct, leur environnement ou des déterminations biologiques, les actes et les pensées des hommes le sont eux-mêmes par de multiples facteurs à la fois internes et externes dont on ignore le plus souvent l'existence et la puissance : facteurs d'origine physiologiques, psychologiques, sociales, etc",0
"Voilà le chemin à suivre, finissons-en avec ce décalage inacceptable entre la cuisine d'en haut (consommée par une minorité) et la cuisine d'en bas, celle de la majorité silencieuse, débordante et insipide.",0
"S'ils vont au cinéma pour l'avant-première, ils verront le dernier film de ce réalisateur de notoriété internationale.",0
"Vous pouvez expliquer encore une fois, s'il vous plaît ?",1
Il y a eu trois expéditions.,0
Les Inuits attendent seulement d'elle une déclaration politique.,0
"""On pensait autrefois que si les régimes alimentaires étaient suffisamment énergétiques, les micronutriments suivraient"", explique ainsi Barbara Burlingame, fonctionnaire principale de la FAO.",0
"Considéré dès sa naissance comme un fils à part entière par son père, il ne fut cependant jamais légitimé.",0
"Nous sommes en 1915, à Vitebsk, la ville natale de Marc Chagall.",0
"Un présage connu rapporte qu'un milan venu du ciel aurait fait un vol stationnaire au-dessus de son berceau, la queue de l'oiseau le touchant au visage.",0
"Cet héritage s'est d'ailleurs vite révélé hétérogène : les pays pauvres d'Asie orientale, les plus éloignés des anciennes métropoles, ""émergent"" à des degrés divers dans l'économie mondiale dès les années 1970-1980.",0
"Trop se spécialiser dans un environnement qui change sans cesse, c'est comme rouler vite avec des oeillères.",0
"Merci Madame, biologiste, vous avez fondé le site, l'association Inversons la classe.",0
"Je crois qu'en cinquante ans d'amitié on ne s'est pas disputées une fois, on a eu des petits mots de temps en temps mais jamais on s'est fait la tête, jamais on n'est restées sans se parler, jamais, jamais, jamais.",1
Plusieurs milliers de classes ont participé à ce projet.,0
"Bref, première leçon, le québécois n'est pas un français déformé mais plutôt un français historique, proche de celui qui était parlé en France avant le 17e siècle",0
"L'extrémité supérieure de la corde est attachée à une planchette doublée de liège, et une branche de coudrier très flexible, fichée sur cette planchette, soutient une petite sonnette qui tinte lorsque le poisson, pris à la ligne, donne des secousses à la corde.",0
"Et c'était pas forcément une image qui me plaisait, comme j'avais l'occasion de pouvoir les changer, j'ai voulu le faire",0
"Une semaine au calme, ça procure un vrai plaisir.",0
Il faut aussi poser des questions sur le travail et les horaires de l'entreprise,0
Je recherche une personne pour garder mes enfants de 1 et 7 ans.,1
Je vais prendre ma douche dans ma salle-de-bain.,1
Êtes-vous prêts à découvrir cette histoire de Noël ?,0
"Il passa contre nous, ne s'interrompit pas de parler à sa voisine, et nous fit du coin de son oeil bleu un petit signe en quelque sorte intérieur aux paupières et qui, n'intéressant pas les muscles de son visage, put passer parfaitement inaperçu de son interlocutrice ; mais, cherchant à compenser par l'intensité du sentiment le champ un peu étroit où il en circonscrivait l'expression, dans ce coin d'azur qui nous était affecté il fit pétiller tout l'entrain de la bonne grâce qui dépassa l'enjouement, frisa la malice ; il subtilisa les finesses de l'amabilité jusqu'aux clignements de la connivence, aux demi-mots, aux sousentendus, aux mystères de la complicité ; et finalement exalta les assurances d'amitié jusqu'aux protestations de tendresse, jusqu'à la déclaration d'amour, illuminant alors pour nous seuls, d'une langueur secrète et invisible à la châtelaine, une prunelle énamourée dans un visage de glace.",0
Il ne reste donc plus qu'à attendre.,0
L'objectif est de résuire les risques sanitaires et de diminuer les nuisances sur l'espace public,0
La plateforme mettra à disposition l'ensemble de son catalogue musical et dit vouloir collaborer avec des acteurs locaux pour pouvoir élargir son offre de musique issue du marché concerné.,0
"Nicolas va se marier, pour la deuxième fois.",1
"Également noble de visage et de corps, dans l'action comme au repos, plein de grâce et de puissance mesurée, il gardait au milieu de l'effort le souci inconscient des pures attitudes, et les moindres de ses gestes paraissaient des bienfaits.",0
"Le beau monsieur, qui était magicien, le força alors à le conduire à la montagne, et à ouvrir le rocher en le touchant avec l'herbe merveilleuse.",0
Son grand chapeau à l'espagnole tomba dans un geste qu'il fit ; et aussitôt les instruments et les chanteurs entonnèrent le sextuor.,0
"Du fond de la ténèbre verte, toute criblée de gouttes de lumière, une petite forme humaine, pelotonnée dans son élan, déboula comme un lièvre.",0
Forestier riait beaucoup de l'aventure ; les deux femmes déclaraient que le bavard indiscret n'était qu'un goujat et qu'un lâche.,0
Il travaille en ville.,1
"En juillet, ma famille et moi irons dans le Sud de la France.",0
Je vais revenir avec les enfants la semaine prochaine.,1
"La recomposition conjugale après 50 ans est en forte progression, précise Vincent Caradec, professeur de sociologie à l'université de Lille III (Vieillir après la retraite, PUF).",0
"Ils sont trop mignons Mon préféré est noir et blanc, et il s'appelle",0
Cette situation est d'autant plus préoccupante que la part de création de valeur des entreprises issue de la valorisation de ces actifs intellectuels est jugée par certains comme dépassant actuellement celle générée par les actifs matériels,0
"À gauche, c'est ma salle de bain, avec vue sur mon jardin.",0
"Et après, on peut prendre un bain dans la piscine, l'eau est bonne !",1
"""Or, une forte exposition médiatique d'un événement sportif, qui plus est lorsqu'elle est associée à de bonnes performances de la part des sportifs (en particulier français), est susceptible de générer un engouement pour la pratique sportive"", explique l'Insee.",0
"Par-delà ces collines, dont le faîte offre des ermitages qu'on voudrait tous habiter, l'oeil étonné aperçoit les pics des Alpes, toujours couverts de neige, et leur austérité sévère lui rappelle des malheurs de la vie ce qu'il en faut pour accroître la volupté présente.",0
"En gros, je n'ai rien contre les uniformes.",0
Ma maison est grande,1
Je vous coupe les cheveux.,1
L'homme avait l'intention de sortir sa femme du trou.,0
Un technicien fait le nécessaire et vous rappelle dans une heure environ.,1
Elle avait besoin de passer un instant seule.,0
"Or une telle vie, guidée par des désirs multiples, polymorphes et surtout infinis, mène nécessairement au tourment et au malheur",0
"En 1902, pour éviter l'extinction, le parc national de Yellowstone (Wyoming) prend en charge vingt et un bisons : ils deviennent la première espèce animale protégée.",0
"Le prince Charles, 56 ans, et sa compagne, Camilla Parker-Bowles, 57 ans, ne s'apprêtent-ils pas à convoler, enfin?",0
Je ne pourrai pas venir demain.,0
Avoir un chien est un vrai bonheur mais encore faut-il s'en occuper correctement.,0
Cerveau et seau de plage jouent-ils les vases communicants ?,0
Que restera-t-il à la rentrée des acquis de l'année scolaire ?,0
Envoie-moi un mot pour confirmer votre présence.,1
Le cabotin diplomate avait même soin de faire toujours glisser dans les réclames une phrase poétique sur la fascination de sa personne et la sensibilité de son âme.,0
Nous nageons dans la piscine.,1
"La couverture du bouquin était couleur bleu turquoise, je l'ai adorée dès que je l'ai vue.",0
"De Buren exprime ces différents points de vue sur la ressource à travers une triple définition du concept : la ressource institutionnelle, telle qu'elle perçut au travers des règles qui encadrent ses usages, la ressource physique perçue au travers des fonctions qu'elle remplit et finalement la ressource sociale, lorsqu'elle est envisagée au travers des relations, qui se nouent entre ses usages.",0
Ce commandant mena plusieurs batailles épiques grâce à sa bravour et ses tactiques militaires ingénieuses.,0
"Selon un sondage publié en mai dernier par BVA (société française de sondages) et le Syntec Numérique (fédération professionnelle du secteur informatique) favorable à la mesure, 87 % des Français seraient même d'accord pour que la programmation informatique soient enseignée à l'école.",0
Je suis devenue très copine avec la fille de 14 ans.,0
"Le deuxième profil représente les cantons qui ont des instruments de contingentement spatial à l'apparence similaires à ceux du premier groupe, mais qui sont utilisés avec une précision moindre et ouvrant plus facilement la porte à des exceptions et à des modifications des limites des zones constructibles.",0
"De peur de paraître ridicule, Emma voulut, avant d'entrer, faire un tour de promenade sur le port, et Bovary, par prudence, garda les billets à sa main, dans la poche de son pantalon, qu'il appuyait contre son ventre.",0
Les appréciations sur le bulletin de notes sont aussi importantes que les moyennes elles-mêmes.,0
"D'abord, nous voulions dormir à l'hôtel mais finalement Martine, mon amie d'enfance, nous a proposé d'aller chez elle alors nous avons accepté.",0
"A l'arrière, ils ont un jardin magnifique.",0
"À mi-parcours, il doit souvent faire demi-tour.",0
Vous mangeâtes des escargots et des langoustines servis dans un plat garnit de glace pillée afin de conserver le met prestigieux au frais.,0
La réponse est oui.,1
Chaque organe doit trouver sa place en fonction de critères différents comme le centre de gravité.,0
"Le centre commercial est l'endroit idéal pour passer un bon moment avec sa famille, ses amis ou ses collègues de travail",0
"Elle sourit involontairement de vanité, en voyant la foule qui se précipitait à droite par l'autre corridor, tandis qu'elle montait l'escalier des premières.",0
