sentence,A1
"Que le vulgaire croie à des comètes extraordinaires qui traversent l'espace, ou à l'existence de monstres antédiluviens qui peuplent l'intérieur du globe, passe encore, mais ni l'astronome, ni le géologue n'admettent de telles chimères.",0
Vous avez fait de l'exercice physique,0
Tour d'horizon du bilan de ces douze jours de tractations.,0
Je suis dentiste dans un nouveau cabinet depuis une semaine et j'aime mon travail,0
"Par conséquent, d'après Marx, les Hommes qui détiennent les clés des désirs de l'humanité auront en leur possession un pouvoir immense et une responsabilité d'autant plus importante",0
Tapez votre message sur les touches de votre téléphone,1
J'aimerais bien être figurant dans un film mais je n'ai pas encore eu l'occasion de l'être.,0
Il préfère quand les sommes ne sont pas arrondies,0
"Quand les joueurs eurent terminé le match, ils prirent une boisson énergisante.",0
"Une abeille m'a piqué, c'est très douloureux.",0
Comment est votre blanquette ?,0
Quelles sont-les démarches à faire pour obtenir ce documment?,0
C'est au premier temps de la colonisation du continent américain par les colons européens au XVIIe siècle qu'il faut remonter pour comprendre cette fête si particulière,0
Rien ne vaut un bon livre !,0
"Malgré leur situation privilégié, ces chatons connurent déjà la misère, la famine et le froid extrême.",0
J'ai un frère et une soeur.,1
"Il déplaçait les chaises, en faisait des obstacles, la forçait à pivoter pendant une minute autour de la même, puis, quittant celle-là, en saisissait une autre.",0
"Au début, l'Homme est un être naturel comme les animaux, or il est aussi naturellement démuni face aux autres car le frère de Prométhée, Epiméthée, omet de le doter d'une capacité qui lui permettrait de survivre",0
"Au sein du gouvernement français, rares sont ceux qui peuvent afficher sur leur CV ne serait-ce qu'une année à la fac!",0
"Il élabore des méthodes pour défendre la ville d'une attaque navale des Turcs avec, notamment, l'invention d'un scaphandre à casque rudimentaire.",0
Je lis un livre très intéressant !,1
Elle allait vers le sud où il faisait moins froid.,0
Elle est certainement devenue mauvaise à cause de son mari.,0
C'est un retour impatiemment guetté par les gamins des bourgades bretonnes.,0
"Les pèlerins partagèrent alors cette célébration avec leurs voisins indiens, et ceux-ci apportèrent alors des dindes à rôtir",0
J'habite un quartier calme,1
"L'étude des dépouilles avec l'aide d'archéo-vétérinaires a permis de remarquer que la plupart des animaux enterrés à Bérénice sont morts de maladie, parfois jeunes, ou de blessure.",0
"En effet, sitôt rentrés chez eux, Vanessa, 14 ans, Raphaël, 16 ans, Marie, 44 ans, et Patrick, 45 ans, branchent les petites boîtes colorées afin de les recharger.",0
"Avant Noel, vous achetez des cadeaux pour tout le monde.",1
"Plus grave, un lien a été mis en évidence entre ces usages et des symptômes de dépression.",0
"Pourfendeur des sciences et des arts, fossoyeur de la propriété privée, contempteur de la monarchie, ce bonhomme, qui égratigne au passage les médecins, les femmes, les gens de lettres et les Anglais, sent le fagot.",0
J'ai décidé de peindre les murs en jaune et d'y installer mon piano.,0
Un bureau !,1
"Chêne, mon aile est cassée, je ne peux pas voler.",0
"Or, il faut bien différencier une contrainte d'une obligation, qui elle est une activité que l'individu s'impose lui-même librement",0
Elle porte des lunettes.,1
"Au fond, beaucoup franchissent avec vaillance le mur du son de la cinquantaine.",0
Je suis une passionnée de montagne.,1
On ne peut pas utiliser son portable et il n'est pas permis de manger,1
"C'est à dire, ce n'est pas une volonté hiérarchique qui viendrait des ministères ou de l'Académie, ce sont les enseignants qui, il suffit de regarder divers blogues sur internet d'enseignants qui se posent des questions au primaire, secondaire, collège, lycée.",0
"Ainsi, il existe déjà une méthode pour passer du virtuel au réel.",0
Hier s'est terminé le Salon de la pâtisserie de Paris.,0
Les enquêteurs sont convaincus que l'écoute électronique des conversations téléphoniques est un outil essentiel à la police.,0
"Bon résultat de l'économie française ce mois-ci, plus quatre pour cent",0
Il a rendez-vous chez le médecin,1
"Souvent, je m'arrêtais pour parler avec les villageois.",0
"Le monastère avait donc conservé son église médiévale, qui faisait également office de paroissiale.",0
mais aussi des fraisiers : je me régale et je fais le plein de vitamines J'espère que tu passes de bonnes vacances à Limoges,0
"Curieusement, l'actuel président du groupe Radio-France ne se souvient pas du débat après l'arrivée de M. Aphatie : Son arrivée n'a pas été critiquée, car il était évident que Jean-Michel Aphatie avait beaucoup de présence à la radio.",0
Il ne peut en rester qu'un.,0
"Dans le sac, il y a un téléphone, des clés, un ordinateur, une photo et un portefeuille",1
"Tous les dimanches, je vais faire mes courses au marché.",1
L'école a-t-elle fait changer le monde ?,0
"Le backtesting évalue essentiellement la performance d'une stratégie de trading sur des données historiques, si nous avons utilisé une stratégie donnée sur un ensemble d'actifs dans le passé, dans quelle mesure elle aurait été performante.",0
"Depuis qu'elles se sont diversifiées, au moins 30 000 sont nées et se sont éteintes, souvent sans laisser de trace.",0
Je travaille chez moi le matin et l'après-midi,1
"Avec de nombreux professionnels, j'ai appelé, en tant que contrôleuse générale des lieux de privation de liberté (CGPL), à une vaccination massive du personnel et des prisonniers.",0
"Au regard des défis posés à la société multiculturelle, le couple mixte se présente comme un laboratoire intensif (de tous les instants) d'échanges, d'analyses, de synthèses, capable d'imaginer des solutions originales applicables à un niveau individuel mais susceptibles d'inspirer les politiques collectives ou dans certains cas d'être transposées à l'échelle de la société.",0
Nous ne nous attendions pas à un tel buzz.,0
"Oh, mais attends une seconde !",0
Vous allâtes dans une contrée lointaine pour tout oublier de vos erreurs passées dont seul le commun des mortels ignore.,0
"La salle commençait à se remplir, on tirait les lorgnettes de leurs étuis, et les abonnés, s'apercevant de loin, se faisaient des salutations.",0
Débuter la journée par un premier repas organisé autour d'une de ces boissons dopantes que l'on sucre preut sembler passablement anecdotique.,0
Le tas de riz tantant tanta le tas de rats tentés.,0
A t'il parlé d'astuces pratiques pour un bien-être quotidien et d'un questionnement philosophique sur cette quête de l'impossible,0
"Accusé de manger à tous les râteliers, l'élu démissionne.",0
"Lui qui, enfant, suivait sa mère trappeur, peut encore aujourd'hui emmener son fils de 14 ans chasser, mais dit craindre la réduction des quotas de chasse pour les ours polaires.",0
"Un enseignement fondé sur l'expérimentation et la pratique, des objectifs d'apprentissage transversaux, des actions tournées en priorité vers la formation continue des enseignants, menées en collaboration avec la communauté scientifique et professionnelle",0
"Alors qu'elle revenait du marché à travers la brousse, une femme laisse tomber une cruche et continue son chemin sans s'apercevoir de rien.",1
"Le bébé pleure depuis des heures, il a faim.",1
"Les cadeaux seront déposés à son pied, le soir du 24 ou le 25 décembre au matin",0
"Dans cette ville, tout comme à Paris et Londres, les autorités ont déjà décidé de mettre en place des règles pour limiter la durée de location.",0
"vec ses livreurs à vélo aux énormes sacs à dos carrés, l'entreprise est devenue incontournable pendant la pandémie.",0
Depuis combien de temps?,0
Idem pour les voies technologiques.,0
"Il savait déjà qu'il faut éviter les aliments grossiers, les lourdes venaisons et les boissons fermentées ; il connaissait aussi l'influence bienfaisante des bains fréquents, qui gardent la peau saine et reposent des fatigues.",0
C'est la jungle.,0
"SpaceX, officiellement Space Exploration Technologies Corporation, est une entreprise américaine spécialisée dans le domaine de l'astronautique et du vol spatial.",0
La merveilleuse paix de cet été endormi entrait en moi comme une marée.,0
"""Aujourd'hui nous magnifions les robots pour faciliter leur future acceptation sociale"", relève le psychiatre Serge Tisseron de l'université Paris-VII, dans le magazine Les dossiers de la Recherche. Mais cette forte empathie peut avoir son revers.",0
Les dernières semaines avant Noël se déroulent dans une ambiance joyeuse et féérique,0
Or ces mêmes statistiques en témoignent :on trouve,0
"Mais, déjà, le commerce équitable commence à être récupéré par des entrepreneurs au nez creux et peu soucieux de respecter les critères fondamentaux, trop contraignants.",0
C'est les discussions d'aujourd'hui.,0
Cette assurance me calma ; je sentis ma douleur s'apaiser.,0
Papa raconte une histoire aux enfants pour les endormir.,1
"Mis en place par l'éco-organisme Récylum, ce dispositif intéresse en premier lieu les entreprises du bâtiment, mais aussi les industries et les collectivités territoriales, qui détiennent du matériel (alarmes incendie, caméras de surveillance) qui ne fonctionne plus.",0
J'en conclus que les Réalistes de talent devraient s'appeler plutôt des Illusionnistes.,0
"Vous ouvrîtes la boîte à musique et découvrîtes un bijou, serti de pierres précieuses multicolors.",0
"Si nous avions eu suffisament d'argent, nous aurions pris l'avion pour nous rendre à notre conférence sur les enjeux écologiques du siècle et ainsi participer activement au débat.",0
Je ne veux pas.,1
La journée est longue pour David qui attend le samedi toute la semaine.,0
"Nous souhaitons favoriser davantage la création et l'ouverture à d'autres publics"", explique Nathalie Perrin-Gilbert.",0
Je me réjouis de te revoir pendant les vacances.,0
"De fait, les relations de l'individu au groupe, du privé au collectif, demeurent complexes dans l'Hexagone.",0
Il était une fois une petite fille de village.,0
L'addition s'il-vous-plaît !,1
"Ils doivent également présenter, le cas échéant, les documents justifiant de l'objet et des conditions de leur séjour",0
Un petit garçon : On essaye de leur parler,0
Le couple a bien fait d'évacuer,0
"Lorsqu'elle eut revu son premier amoureux, son coeur battit follement",0
"De fait, en scindant son enseignement supérieur en deux systèmes concurrents, la France a créé une hiérarchie dans toutes les têtes: la grande école est synonyme de réussite, l'université de rebut.",0
On le trouvera ridicule et ce sera une catastrophe.,0
Qu'est-ce que vous avez comme tartes ?,1
On partait de bonne heure pour ne pas être coincés dans les embouteillages,0
La FAO (Organisation pour l'alimentation et l'agriculture) estime que 95 % des personnes victimes de sous-alimentation chronique vivent dans les pays en voie de développement.,0
"On vient d'acheter une résidence secondaire, au Pays basque, qui sera notre point de ralliement familial.",0
"L'échange, c'est-à-dire l'interaction verbale, se présente comme une co-construction constitutive de la dynamique du groupe ; c'est en tenant compte des interlocuteurs et de la façon dont ils se positionnent les uns vis-à-vis des autres, selon les objets et les enjeux des interactions, que l'on envisage d'analyser tant la variation des usages en présence que l'hétérogénéité constitutive du dire, dans cet espace.",0
Mon mari a enfin trouvé une place d'architecte et travaille sur un important projet d'immeuble avec son équipe,0
C'est somptueux.,0
Bonne chance !,1
J'ouvrais la porte et le chien courait à l'extérieur.,0
"Mais qu'ils prétendent être les seuls acteurs légitimes pour définir et normaliser le commerce équitable, c'est nier les autres pratiques et refuser le débat avec tous les acteurs de la société civile, ce qui est inadmissible.",0
"Non, Je ne parle pas français.",1
Il est tombé malade l'année précédant son mariage.,0
Les maires ont ainsi voulu montrer qu'ils les avaient à l'oeil.,0
"Il allait devoir passer l'hiver ici, dans la forêt, en attendant d'être guérit.",0
Il est très fâché parce qu'elle ne lui a pas répondu au téléphone.,1
"Celui-ci, ancien soldat, devinant d'abord le plan de campagne de son interlocuteur, parla des protections qu'avait son maître, ajoutant que, certes, on ne lui chiperait pas ses beaux chevaux.",0
Je ne te crois pas.,1
Le journal a été emporté par un coup de vent.,0
"Les optimistes soulignent qu'il ne représente encore qu'une part infinitésimale des échanges internationaux mais que le concept est ""porteur"".",0
"Sans y penser, j'ai fait des erreurs !",0
"Quand tu sors de l'ascenseur, tourne à droite et encore à droite.",0
"Et il regardait tous ces hommes attablés et buvant, tous ces hommes qui pouvaient se désaltérer tant qu'il leur plaisait.",0
Elle a préparé les photocopies pour les participants à la réunion de l'après-midi,0
"Ainsi, Madame, qui est irlandaise et vit à lieu, témoigne : ""En France, si je parle anglais à mon fils, il me répond plutôt en français.",0
Capacités intellectuelles ou problèmes d'orientation ?,0
A affronter ce monde et l'améliorer.,0
"Deux guerres mondiales, en 1914 et 1939, convainquirent cependant de nombreux Européens que le Concert européen avait échoué et ne parvenait plus à gérer les affaires du continent.",0
Il y a des cours de portugais.,1
Les spécialistes de la violence chez les adolescents rappellent qu'il est dangereux de les considérer comme une armée menaçante.,0
"Malheureusement, il ne s'agit que de moyenne.",0
Le paysage devient tout blanc à cause de la neige et de la glace.,1
"L'après-midi, j'ai encore beaucoup de choses à faire",0
"De fait, la nature peut être, par l'homme, changée tout à fait, transformée, ébranlée jusqu'en ses fondements, et c'est pourquoi il sied de réhabiliter le mot de magie, en lui redonnant le sens honorable qu'il avait autrefois et en désignant par là une science justement ambitieuse qui, de la connaissance des formes cachées, déduit des opérations étonnantes.",0
Le bleu est très présent dans la nature : c'est la couleur du ciel et de la mer.,1
"Elle fais ses devoirs puis prépare le dîner et finalement, elle regarde un film avant d'aller se coucher.",0
Pas de fête avec vous ce soir,1
Je n'arrive plus à dormir depuis quelques jours à cause de mes voisins et leurs travaux.,0
"C'était une chétive créature, une masse de chair ridée, avec des paupières entre-closes, des traits informes et à peine ébauchés.",0
J'aime les pommes de terre.,1
Elle a juste miaulé craintivement et s'est recroquevillée sur sa branche oú elle se trouve.,0
"Mesdames, messieurs, votre attention s'il vous plaît.",0
"En cinquante ans, les progrès accomplis par les techniques de l'information ont entraîné une amplification extraordinaire des flux d'informations.",0
Je regarde un film en allemand.,1
Les vacances sont les moments préférés de Pierre car il a pour habitude d'aller chez ses grands-parents qui vivent dans une ferme de la campagne normande,1
Figurez-vous un Turc allant la nuit chez Paul Niquet!,0
La comtesse s'était passionnée pour le caractère primitif et pour l'astrologie de l'abbé Blanès.,0
"Pour dissuader ses lycéens de faire les Beaux-arts, l'École du cirque ou un diplôme d'arts du spectacle, un proviseur avait coutume de leur raconter cette histoire : ""J'avais deux copains",0
"Perrette, retenant sa respiration tellement était forte l'odeur nauséabonde d'huile de vidange, dans la chambre-garage.",0
"Néanmoins, l'introduction de la notion de genre dans la santé entraîne une meilleure compréhension des processus biologiques et sociaux intriqués qui influencent les trajectoires de santé des hommes et des femmes.",0
"Pour conjurer les deux mois de vacances, ils achètent donc leur potion en librairie pour un investissement moyen de 7 euros",0
Le courant d'air ainsi créé permet à la sueur - qui absorbe la chaleur du corps - de s'évaporer et ainsi de le refroidir.,0
"La pelle, les pincettes et le bec du soufflet, tous de proportion colossale, brillaient comme de l'acier poli, tandis que le long des murs s'étendait une abondante batterie de cuisine, où miroitait inégalement la flamme claire du foyer, jointe aux premières lueurs du soleil arrivant par les carreaux.",0
Mais les chiens et les chats ne s'aiment pas beaucoup .,1
"Il s'offre les meilleurs guides, gravit les montagnes, s'épanouit",0
Les préadolescents et adolescents semblent particulièrement sensibles.,0
"Les cordes vocales, ce sont des muscles, hein, et donc, j'ai un entraînement quotidien parce qu'on doit être raccord avec des enregistrements qui ont quelquefois 10 voire 15 ans",0
"Elle trouvait ça drôle, finissait par rire, et, s'animant, commençait à trottiner derrière lui, avec de légers cris joyeux et craintifs, quand elle 143 avait cru le saisir.",0
Il est en train de ranger ses affaires.,0
"Tout comme la révolution industrielle a vu naître le capitalisme, je suis persuadé que la robolution va profondément modifier notre système économique.",0
"On a ainsi constaté, chez les femmes urbaines de haut niveau socio-économique, au Brésil, 28 % de réduction de la surcharge pondérale de 1989 à 1997.",0
Cette réponse me bouleversa.,0
"[Les dames rient] Je pense qu'il y aurait de la bagarre, hein",0
"Tu ne mérites pas d'en manger, dit l'autre.",0
"Jeune retraité de l'éducation nationale, Roger Rougier a sa réponse.",0
Tout se passe bien en France ?,0
"Non, elle est fleuriste.",1
"Sans enfants à cinquante-neuf ans, Guido avait, de son propre coeur, préparé pour son enfant à venir un coeur modelé sur sa propre préoccupation : l'hommage sans remords à la noblesse, la génuflexion que fait par contraction musculaire le corps pourchassé en s'affalant devant ce qui est imminent et inaccessible comme devant une grande chaleur.",0
Le plat plein ploie sous le poids ou ne ploie point ?,0
"Et vous l'entendez, ce violon qui joue du klezmer, la musique traditionnelle des juifs itinérants ?",0
"Un principe qui concerne déjà de nombreux produits tels que les emballages, les textiles et les pneus.",0
"Non, bien sûr que non.",0
J'ai une soeur,1
Et j'adresse un défi collectif au parterre !,0
"En étant connecté en permanence à ses amis et en pouvant ""se raccrocher"" à des environnements en ligne familiers, comme sa page Facebook, son compte Twitter ou sa story Snapchat, la personne, éloignée de son environnement familier, ne se sentirait-elle pas alors davantage en sécurité affective, comme dans son foyer où elle a ses repères et habitudes rassurants ?",0
La blanquette est bonne.,0
L'Empereur était à Paris.,0
"Je m'appelle Laurent et j'habite à Paris avec mes parents, ma soeur ainée et mon frère.",0
"Puis, il y eut une pause lugubre, suivie d'un vaste soupir d'agonie où l'on eût dit que l'âme de la grosse cloche s'exhalait.",0
La règle du frein à l'endettement devrait traiter de manière symétrique les dépassements de dépenses et les économies réalisées.,0
"La spirale vicieuse, cette mécanique qui entraîne vers le bas, n'est pas, dans le discours des milieux populaires, liée à une conjoncture négative.",0
Ils ne se parlent plus depuis qu'ils se sont disputés.,0
"Pour Yak Rivais, le langage fait certes travailler le cerveau, mais aussi l'oeil et l'oreille.",0
"En brisant le fatum des itinéraires sociaux, en augmentant le temps de la formation, en accroissant l'autonomie des individus, les sociétés modernes ont inventé la jeunesse et celle-ci ne cesse de s'allonger, jusqu'à 25 ans et au-delà.",0
"Je ne me couche pas trop tard, vers minuit",1
"""Nous allons essayer à nouveau (ndlr: d'entrer en contact avec lui). Mais les chances de rétablir la liaison sont très très faibles"", a déclaré à l'AFP Stephan Ulamec, responsable de l'atterrisseur, depuis l'Agence spatiale européenne (ESA) à Darmstadt (Allemagne).",0
"Ajoutons, pour parfaire ce tableau, que ces seniors ont reçu de la science la perspective d'un quart de siècle de longévité supplémentaire traversé en relative bonne santé.",0
"Une fois ces déclencheurs identifiés, il faut alors élaborer des stratégies pour les éviter ou y faire face.",0
Elles se réveillèrent très tôt hier matin afin de se rendre au tribunal pour plaider la cause de leurs maris injustement accusés d'escroquerie.,0
"Après la transfusion, le sang provenant d'un don de sang complet ou d'un don par aphérèse est congelé à une température de moins 30 degrés Celsius et est mis en quarantaine.",0
"Or peut-on se contenter de cette expérience immédiate ou pour reprendre la formulation de Bergson, de cette ""donnée immédiate de la conscience""",0
La compagnie qui le gère est à majorité anglaise.,0
Je profite aussi du petit-déjeuner pour lire les infos en ligne,1
"Toutefois, ce système répond à des critères précis et exigeants, difficilement compatibles avec le développement à grande échelle auquel il est appelé.",0
"Oui, la raison a pu s'accommoder de la théologie païenne.",0
"Confronté avec rien de pire qu'un général en cuir crissant et ces mouvements légèrement percutants qui sont communs aux personnages militaires, lesquels semblent aspirer l'air au- dedans, sentent la poudre à canon et la chair de cheval, et, bien que léthargiques, ont l'air prêts à participer à une guerre encore indéterminée (type d'hommes pour lequel Hedwige s'était senti beaucoup d'inclination), Guido avait été secoué d'un tremblement invisible.",0
"Cette action avait pour objectif dès l'origine d'aider les professeurs à enseigner la science et la technologie en mettant en oeuvre une pédagogie privilégiant l'expérimentation, la discussion, une pratique active et collective.",0
"Elle portait une robe marron foncé, qui moulait sa taille, ses hanches, sa gorge, ses bras d'une façon provocante et coquette ; et Duroy éprouvait un étonnement confus, presque une gêne dont il ne saisissait pas bien la cause, du désaccord de cette élégance soignée et raffinée avec l'insouci visible pour le logis qu'elle habitait.",0
"Les papy-boomers sont individualistes, ce sont d'ailleurs eux qui ont mis en vogue le concept.",0
Une politique de sécurité est un outil de gouvernance qui permet de traiter la sécurité comme un processus de gestion continu en fonction d'objectifs stratégiques clairement définis.,0
Tout le monde n'a pas l'argent pour se payer une machine à laver.,0
"Lettres de motivation, d'amour ou de rupture, relecture de mémoires d'étudiant, textes d'hommage à lire et à distribuer pendant des obsèques, situations administratives à démêler avec la banque, les impôts ou la copropriété, l'écrivain public doit pouvoir répondre à toutes les demandes.",0
Et donc je te remercie pour tout ton boulot.,0
Elle se rendit compte qu'elle travaillait dans la pénombre et alluma la lampe posée sur le bureau.,0
"Au premier étage, il y a trois chambres",0
Paul a le numéro de téléphone de Marie.,1
Ils font à manger et ils nettoient toujours la cuisine juste après.,0
Elles font des cracracracracraaa ! Et moi j'en fais autant : on s'amuse !,0
"En 2001, Rosalie a expliqué à l'ONU, auprès du groupe de travail sur les peuples autochtones, en quoi la survie des bisons sauvages est essentielle et symbolique pour les Indiens des plaines.",0
"Si t'as trouvé le vidéo le fun, pense à aimer notre chaine YouTube et notre page Facebook",0
"Par crainte des représailles, les contestataires ont été moins nombreux mardi dans les rues.",0
"Ce récit fascine toujours notre science-fiction, Blade Runner de Ridley Scott (1982) ou Her de Spike Jonze (2013) en témoignent.",0
"Mon énergie, mon temps, mon argent.",0
Qu'est-ce que tu penses de cette peinture ?,1
"En France, c'est l'enseignement catholique qui, le premier, a osé briser le tabou, en rediscutant des vices et vertus de la mixité depuis ses assises de décembre 2000.",0
"Si nous sommes bloqués dans l'ascenseur qui s'est arrêté brusquement, nous appellerons du secours dès que la communication sera établie.",0
"Il vient de la racine slave ""robota"" qui signifie travail de force.",0
Il a donc rejeté tout changement de mode de scrutin qui introduirait des mécanismes partisans et abstraits dans ces collectivités où l'appartenance politique des élus est fort peu prise en compte.,0
Mais les chocs pétroliers plongent la France dans la crise,0
Ce texte invite les États à prendre toutes les mesures possibles dans la pratique pour veiller à ce que les membres de leurs forces armées qui n'ont pas atteint l'âge de 18 ans ne participent pas directement aux hostilités (Art.,0
"Vous êtes biologiste, militante passionnée de cette pédagogie, vous allez nous expliquer pourquoi le sujet vous passionne.",0
Souvent elle était rêveuse et taciturne ; quelquefois elle parlait avec impétuosité.,0
La dame ne vient pas.,1
"Après cette crise, qui se renouvelle toutes les nuits, je dors enfin, avec calme, jusqu'à l'aurore",0
Elle raconte leur quotidien à travers les enfants qu'elle a aussi aidés à faire leurs devoirs,0
On peut voir aussi le fleuve qui traverse la capitale,0
"Bruno Bonnell Le vieil adage ""on n'arrête pas le progrès"" n'a jamais été aussi vivace. D'autres pays s'équipent en robotique pour atteindre des taux de productivité supérieurs aux nôtres.",0
