sentence,A1
"L'avantage des galeries, c'est qu'elles sont souvent gratuites contrairement aux musées dont l'entrée est souvent payante.",0
"Le romancier qui transforme la vérité constante, brutale et déplaisante, pour en tirer une aventure exceptionnelle et séduisante, doit, sans souci exagéré de la vraisemblance, manipuler les événements à son gré; les préparer et les arranger pour plaire au lecteur, l'émouvoir ou l'attendrir.",0
"Ca va, merci.",1
"Enseigner à apprendre, même par ceux qui ne réussissent pas.",0
"Chez les Musulmans, par exemple, elle est obligatoire avant la prière.",0
"Les avantages et inconvénients offerts par les deux-roues, et les différents types de motocyclette permettent une utilisation variée, tantôt complémentaire aux véhicules personnels, tantôt concurrentielle.",0
"Habitant dans la même région, ils vont souvent boire un verre en ville",0
"En redescendant à pied, il s'arrêtera pour visiter le plus ancien théâtre gallo-romain de France, puis ira dîner dans un bouchon lyonnais, restaurant typique de la ville",0
On peut voir aussi le fleuve qui traverse la capitale : la Seine.,0
Il faut commencer par dire que l'Union européenne n'est pas l'Europe.,0
"Dans le centre de la ville, il y a un très joli quartier, plein de magasins chics et de bons restaurants. Pour se déplacer, il y a des bus, des vélos et un métro.",0
"Après plusieurs heures de marche, j'atteignis l'énorme bloc de pierre qui porte la petite cité dominée par la grande église.",0
C'est incroyable qu'il ait fait si beau au mariage de ta soeur l'été dernier!,0
"Elles le contemplaient toutes les deux, l'approuvant du regard, trouvant qu'il parlait bien et juste, confessant par leur silence ami que leur morale inflexible de Parisiennes n'aurait pas tenu longtemps devant la certitude du secret.",0
Comment ?,1
Je m'appelle Henri.,1
"Eh bien voilà, bienvenue dans mon studio",0
"Vous eussiez juré que les gens la voyaient, l'entendaient rouler pesamment devant eux, retentissante de tous les trésors enfermés dans ses flancs.",0
Mais si on n'a pas les moyens de le faire on le fera pas.,0
Il y a belle lurette que les entreprises françaises se sont délocalisées pour optimiser leurs coûts et s'ouvrir de nouveaux marchés,0
"Sans doute aussi à la désastreuse organisation universitaire du savoir historique, qui, en France, a été très dommageable !",0
"Nous sortons au resto, au ciné, au théâtre, nous partons en week-end.",0
"C'est en décembre 1967, après bien des invectives au Parlement, que sa loi relative à la régulation des naissances, dite loi Neuwirth est votée : elle autorise la vente exclusive des contraceptifs en pharmacie sur ordonnance médicale, avec autorisation parentale pour les mineures",0
"Elle attachait le plus grand prix à la régularité de la conduite, précisément parce que la sienne n'était pas régulière suivant les notions reçues.",0
Est-ce que je peux chercher mes valises ?,1
"La raison invoquée : la mise en péril du mode de vie ancestral du peuple Inuit, du fait des changements climatiques provoqués par les activités humaines.",0
"Première étape incontournable, dessaler la morue en la plongeant 20 minutes dans un grand volume d'eau bouillante",0
Comme à la même période ont également amené à penser que le problème de la définition de la valeur réelle des entreprises ne concernait pas seulement les sociétés de hautes technologies mais toutes les sociétés où la part des actifs immatériels ou intangibles est importante,0
"Le jeune amant, ne pouvant obtenir sa maitresse, se consumait de douleur ; elle lui conseilla de voyager pour l'oublier.",0
"Depuis l'après-guerre, et jusque dans les années 1990, il s'est produit en Suisse un phénomène dont les effets persistent encore aujourd'hui: les migrantes et migrants sont venus occuper par vagues successives les places les plus basses de l'échelle professionnelle, permettant l'ascension sociale des personnes non issues de la migration.",0
Que voulez-vous ?,0
À dimanche!,1
Le ministre de l'Education nationale a assuré que ces étudiants seront rémunérés pour la réalisation de ces tests.,0
"Dans certains pays, la prise de décision est aux mains d'un petit groupe de personnes ou de clans au sein du gouvernement qui considèrent les forêts primaires comme une source de revenus personnel à court terme, ce qui entraîne la conclusion de contrats rapportant principalement des bénéfices à l'investisseur et à certains fonctionnaires.",0
"C'est le cadre idéal pour un dîner romantique, mais c'est aussi un endroit tranquille pour les repas d'affaires.",0
"Je cherche cette adresse, vous pouvez m'aider ?",1
"Forestier, tout à fait vautré sur les coussins, riait, buvait, mangeait sans cesse et jetait parfois une parole tellement osée ou tellement crue que les femmes, un peu choquées par la forme et pour la forme, prenaient un petit air gêné qui durait deux ou trois secondes.",0
"Le montant des recettes des impôts sur l'énergie dépend non seulement du taux d'imposition, mais aussi de la quantité d'énergie consommée, elle-même influencée par la situation économique, les conditions météorologiques et les prix.",0
"Où sont les toilettes, s'il-vous-plaît ?",1
La digestion est plus difficile.,0
Elle est surprise que les étudiants soient toujours en retard.,0
Je vais prendre la formule à 15 euros.,1
"C'est une activité en plein développement car aujourd'hui on ne veut plus seulement profiter du pays ou du village qui nous accueille, mais on souhaite de plus en plus participer réellement à la vie de celui-ci.",0
L'important est que tu prennes du plaisir à écouter ces histoires.,0
"La charpente et la couverture ne sont plus étanches, les balustrades en granit sont abîmées, certains parements doivent être remplacés ou consolidés, quatre verrières du XIIIe siècle, les plus anciens vitraux répertoriés en Bretagne, ne sont plus protégés.",0
"Deuxièmement, Spinoza précise bien que les hommes ""se vantent"" d'être libre car le désir d'être libre, même illusoire, est beaucoup plus valorisant pour l'orgueil humain que l'idée d'être totalement déterminé",0
"Hier, j'ai lu un peu et j'ai dormi sur le divan en cuir.",0
Il pensait qu'un chef pouvait manger des pizzas et des frites tous les jours.,0
"Malgré les récentes réformes, le régime public constituant le premier pilier du système de retraite reste confronté à des problèmes de viabilité.",0
"À l'âge d'un an, il entrera dans une école pour suivre une formation pendant six à huit mois.",0
Parce que ça renforce vraiment les interactions entre les enseignants et les élèves.,0
Les horaires de travail sont parfois décalés en fonction de la nature et de la disponibilité des publics contactés (le soir par exemple).,0
"C'est peut-être un petit frère, un gentil chien comme moi .",1
"Et d'ajouter, afin de faire de l'école publique un lieu consensuel et inclusif, que les enseignants qui ""outrageraient les croyances religieuses de n'importe qui"" seraient durement sanctionnés.",0
"Ils l'appelaient tous monseigneur, et ils riaient quand il faisait des contes.",0
Plus que ça.,1
"Pendant quelques mois, je ne remarquai rien qui pût captiver mon attention.",0
J'adore ça.,0
Le Danemark est le premier pays du monde à autoriser l'accès à internet lors des examens qui peuvent parfois même compter pour la baccalauréat,0
"On dirait qu'elle ne les a jamais coupés, et ils forment autour de son visage comme une couronne de boucles noires.",0
"Observant que, à l'exception du changement de mode de scrutin pour les communes dont la population est comprise entre 2 000 et 3 500 habitants, le texte issu des travaux de l'Assemblée nationale avait recueilli une approbation presque unanime de tous les groupes de cette assemblée, le rapporteur a souhaité rappeler que la démarche suivie par les députés, consistait à mettre en oeuvre des solutions permettant d'optimiser la présence des femmes dans la vie politique.",0
"Si les produits anti, pré et probiotiques agissent sur le comportement, en modifiant la composition de la flore intestinale, ils pourraient donc servir de médicaments psychotropes.",0
Je vais m'en occuper.,0
Je tombe sur une dame aimable qui a l'air au courant de mon affaire.,0
J'ai un colis pour votre voisine mais elle n'est pas là.,0
Vous avez des frères et soeurs ?,1
L'univers des francophones est un métissage unique et fertile,0
"L'Auberge du Presbytère nous attendait, chambre des vicaires",0
Il eut acheté des méthodes pour apprendre la guitare.,0
Ils sont heureux.,1
"D'ici là, ""l'infosphère"" continuera son expansion vertigineuse ; la masse de connaissances double déjà tous les deux ans.",0
Elle reconnaissait tous les enivrements et les angoisses dont elle avait manqué mourir.,0
"Pour mieux maîtriser son langage en septembre qu'en juin, l'écrivain Yak Rivais propose une approche très personnelle qui n'en finit pas de séduire",0
"Elle fait ses devoirs puis prépare le dîner et finalement, elle regarde un film avant d'aller se coucher.",1
"En attribuant une valeur de flux potentiel aux liens du graphe, la segmentation fondée sur le critère de modularité aboutit à un découpage considéré comme optimal du point de vue de la dynamique démographique interne à chaque compartiment.",0
"Le modele theorique mis en oeuvre ici s'appuie sur l'idee d'un dispositif representatif qui jouerait sur trois niveaux : scenique, scenographique et enonciatif.",0
"C'est là, au bout de la rue.",1
"Je suis bilingue anglais parce qu'en rentrant à la maison après l'école, au lieu de faire mes devoirs, je regardais des séries américaines en version originale",0
"Entre 1860 et 1880, les bisons ont été éliminés par les Blancs pour nous enlever ce qui faisait notre vie : le coeur de notre culture, de notre spiritualité, mais aussi notre principale ressource et source d'alimentation.",0
"Un sondage auprès des Français, commandé à l'occasion de la Semaine du son qui commence lundi 21 janvier, montre l'influence majeure du bruit sur la vie quotidienne.",0
"Malheureusement, seuls les milieux favorisés et plus éduqués sont capables de renverser cette tendance en prenant en compte cet aspect du problème dans leur vie quotidienne.",0
Presque tous les jeunes déclarent aimer leur collège ou leur lycée.,0
Le bureau est en face de la machine à café.,0
Vous souffrîtes du froid intense de l'hiver qui s'engoufrait dans les avenues bondées de passants empressés,0
Cette loi avait pour objectif de permettre aux croyants et non-croyants de vivre ensemble.,0
Mais cette initiative suscite par ailleurs beaucoup de réticences.,0
"Cependant, un recours en urgence a suspendu la décision, imposant le statu quo le temps qu'une cour d'appel examine le dossier, et ce afin d'éviter un ""effet yo-yo"".",0
"Excusez-moi, serait-il possible de changer de table ?",0
"Ce n'est une surprise pour personne: avec le semi-confinement et le télétravail, les conflits entre voisins ont augmenté.",0
"Écris-moi pour me raconter ce que tu fais, comment sont tes nouveaux collègues et comment ça va avec ton chef.",0
Je sors avec des amis.,1
La gestion de la complexité sera bien le défi majeur du XXIe siècle.,0
Marie-Hélène Lahaye a fait et fait beaucoup dans la lutte contre les violences obstétricales et gynécologiques (VOG) mais utilise cette affaire de façon erronée,0
"Machine intelligente (capable d'apprentissage), utilisée déjà dans le contexte des loisirs, de l'éducation, de la médecine, de la police, de l'armée, de la conquête spatiale, etc., le robot est voué à exécuter toutes les tâches pour lesquelles on voudra, ou pourra, le programmer.",0
Mais très vite l'usage de la moto se répandit en commençant par être un outil de travail des professions libérales.,0
"À l'aube de notre modernité, Mary Shelley questionnait la nature humaine et non la machine: le face-à-face entre Frankenstein et sa créature autonome interroge la possibilité d'un homme sans âme.",0
"Dans la forêt aux éclats dispersés de soleil, immobile forêt d'antique effroi, il allait le long des enchevêtrements, beau et non moins noble que son ancêtre Aaron, frère de Moïse, allait, soudain riant et le plus fou des fils de l'homme, riant d'insigne jeunesse et amour, soudain arrachant une fleur et la mordant, soudain dansant, haut seigneur aux longues bottes, dansant et riant au soleil aveuglant entre les branches, avec grâce dansant, suivi des deux raisonnables bêtes, d'amour et de victoire dansant tandis que ses sujets et créatures de la forêt s'affairaient irresponsablement, mignons lézards vivant leur vie sous les ombrelles feuilletées des grands champignons, mouches dorées traçant des figures géométriques, araignées surgies des touffes de bruyère rose et surveillant des charançons aux trompes préhistoriques, fourmis se tâtant réciproquement et échangeant des signes de passe puis retournant à leurs solitaires activités, pics ambuants auscultant, crapauds esseulés clamant leur nostalgie, timides grillons tintant, criantes chouettes étrangement réveillées.",0
J'ai perdu ma montre.,1
"L'objectif étant de susciter un changement d'attitude et un engagement à long terme, et non d'obtenir une quelconque compensation financière, assure-t-on.",0
Le soir vous pouvez faire un tour en bateau jusqu'à la Tour Eiffel.,1
"La salle internet est la deuxième salle après les toilettes, à gauche.",1
"En janvier dernier, j'ai voulu laisser un message sur le répondeur de mon frère.",0
"Viennent ensuite les personnes âgées, puis les personnes malades ou handicapées, qui font l'objet d'une sollicitude en hausse.",0
un berger est une personne chargée de guider et de prendre soin des troupeaux de moutons ou plus généralement de bétail.,0
"Bonjour, je voudrais deux kilos de fraises et un kilo de haricots.",1
"Des sénateurs républicains mais aussi un démocrate s'étaient ouvertement déclarés contre son arrivée au poste de directrice du Bureau de la gestion et du budget à la Maison Blanche (OMB), un service très puissant, notamment chargé de développer le budget voulu par le président.",0
Il s'agit vraiment d'introduire l'informatique dans la culture générale.,0
"En kiosque depuis le 1er mars, le magazine Changer tout résume l'ambition de leur reconversion.",0
Son père se maria quatre fois et lui donna dix frères et deux soeurs légitimes venus après Léonard.,0
"Car, en fait, les Français n'ont pas franchement le beau rôle : désagréables, disant non à tout, préférant fumer plutôt que de manger, démarrant leur journée de travail à 10 h 30, ils sont aussi présentés comme étant les rois de l'infidélité, une pratique acceptée de tous, y compris des compagnes ou compagnons trompés.",0
"Au fond, une grande écharpe en dentelle de Bruges, d'un prix considérable, élargissait un voile d'autel, deux ailes déployées, d'une blancheur rousse ; des volants de point d'alençon se trouvaient jetés en guirlandes ; puis, c'était, à pleines mains, un ruissellement de toutes les dentelles, les marines, les valenciennes, les applications de Bruxelles, les points de Venise, comme une tombée de neige.",0
"Elle tournait tant autour du pot et plus encore, que le marquis perdit patience",0
Il est gros.,1
"Après une marche sur les Champs-Élysées, je suis au pied de la Tour Eiffel",0
"Plus tôt, ils avaient été remis à un procureur, escortés de 15 officiers de police japonais venus spécialement aux États-Unis samedi pour l'occasion.",0
Ils sont au lycée français.,1
"Comme avec Les sorcières sont NRV (Ecole des loisirs), qui n'ont pas pris une ride depuis 1988, et où articles, adverbes et pronoms entrent dans une danse endiablée, ou encore avec LFHE la sorcière (Ecole des loisirs), où cette fois ce sont les adjectifs qui sont prestidigitisés",0
"Il vient de demander la main de Bella et l'avenir semble briller, mais. Quand l'artiste donne le dernier coup de pinceau à sa toile, les nazis ont déjà commencé à expulser les juifs, contraints de quitter leurs maisons, emportant ce qu'ils peuvent.",0
"Je réponds toujours que ça n'a pas été difficile physiquement, mais que j'ai dû travailler sur l'image que donnait ce comique.",0
"Vous êtes embarrassée, presque offensée de mon trouble.",0
Il a déjà inventé une machine à enlever la peau des bananes !,0
"Oh, ça fait du bien de changer d'air quelques jours.",0
"Après le cours, vous boirez un verre en notre compagnie, vous rirez aux éclats et aurez du bon temps avec vos amis.",0
J'aurais voulu pouvoir quitter le bureau à 13h.,0
Je mange de l'herbe,1
"Il faut du temps et du courage pour soigner toute cette ménagerie En plus des animaux, il faut aussi s'occuper du potager de mon papy",0
"Nous devons apprendre une multitude de langages : scientifiques tels le numérique, les langues étrangères, les langages des sons et des images, le langage du corps.",0
"C'est la commémoration, c'est-à-dire la fête anniversaire, de la fin de la Seconde Guerre mondiale",0
"Des variations significatives de cet indice sur une période inférieure à plusieurs décennies sont peu probables en l'absence de réformes territoriales conséquentes, ce qui a été rarement le cas en Suisse après 2000 en comparaison internationale.",0
Statistiquement le risque de transmission de maladies infectieuses est nettement plus élevé dans certaines situations.,0
J'ai passé une très bonne journée de vacances.,1
Quelle est ta chanson préférée dans le spectacle ?,1
"Si on cherche des côtés positifs à cette bluette, quelques répliques sont bien senties et des scènes comiques réussies, notamment quand il est question des subtilités de notre langue et des faux amis, ces mots qui se ressemblent entre anglais et français avec des significations différentes.",0
La traçabilité permet de reconstituer une séquence d'événements à partir des données numériques laissées dans les systèmes lors de leurs réalisations.,0
Anna s'amusait avec son frère quand il s'est cassé le bras gauche.,0
"Oui, je parle un peu.",1
Il y a deux possibilités : soit son accent lui permettra d'être connu et ce sera très bien.,0
"Après 13 ans aussi, pour des raisons sociales, l'enfant commence à éprouver des contraintes caractérielles, des réticences dues à la volonté de défendre son image, à la peur du ridicule, toutes choses qui sont des attitudes d'adulte",0
"Grande amoureuse des couleurs et de la cuisine italienne, Irène Jacob a trouvé dans la culture slave la force de l'expression des sentiments jusqu'au tragique.",0
Je fais du sport tous les jours.,0
"Non, c'est en fonction de la facilité de la chanson.",0
La Chine et l'Inde connaissent depuis dix ans une augmentation du taux de surpoids de 5 %.,0
"Bonjour, ça va ?",1
Donne-moi de tes nouvelles plus souvent !,0
"Oui, des feux de forêt qui frappent le sud-est du pays depuis le mois de septembre et qui ont fait une 24e victime ce week-end",0
"Mets ça sur ton pied, ça va soulager la douleur.",0
"Voie 3, le TGV à destination de Marseille Saint Charles va partir",0
La tour Eiffel est le symbole de la ville de Paris,0
"Avec l'argent, notre professeur va acheter de la peinture et des crayons pour le cours de dessin.",0
"Mais, poursuit Bacon, la science se doit de surmonter ces craintes et ces scrupules: elle doit triompher du sentiment d'impuissance qui la paralyse.",0
Quel est votre avis ?,0
Ils s'étaient imaginé pouvoir surmonter le deuil en se lançant dans les travaux de rénovation.,0
"La comtesse se mit à revoir, avec Fabrice, tous ces lieux enchanteurs voisins de Grianta, et si célébrés par les voyageurs : la villa Melzi de l'autre côté du lac, vis-à-vis le château, et qui lui sert de point de vue ; au-dessus le bois sacré des Sfondrata, et le hardi promontoire qui sépare les deux branches du lac, celle de Côme, si voluptueuse, et celle qui court vers Lecco, pleine de sévérité : aspects sublimes et gracieux, que le site le plus renommé du monde, la baie de Naples, égale, mais ne surpasse point.",0
"Ici, dans le palais, l'air était lourd et étouffant, mais, dans la forêt, le vent soufflait librement et le soleil, de ses caressants doigts d'or, écartait les feuilles frémissantes.",0
Dès qu'elle fut entrée elle fut dérangée par la cigarette.,0
Par ailleurs les conséquences structurelles d'une telle reconnaissance pour une organisation ne sont pas négligeables,0
"Cela étant bien compris, je crois qu'on se tiendra en repos."" Comme Pascal, Edgar Morin cherche à désarçonner le rationaliste qui, au plein de la crise actuelle de notre rapport à la nature, ne doute ni de ses démarches ni de sa volonté d'imposer son ordre.",0
"En haut des tours, il n'est pas conseillé de s'attarder trop longtemps devant le panorama parisien",0
La discipline est encore considérée comme réservée aux hommes.,0
Je propose que tout le monde apporte quelque chose à manger.,1
Vous deviez rendre des comptes à la justice pour vos crimes.,0
Mais pas de maison de poupées,0
J'ai peur du noir.,1
"Nous nous assîmes sur un banc recouvert de verdure, face aux cieux étincellant et nous vîmes l'aurore s'éveiller.",0
"Après ça, nous étions un peu fatigués",0
"Il s'établit donc, dans le petit public qui m'environnait, une inquiétude vague sur mon caractère.",0
"""Le démon partit bien vite, et il se précipita dans le trou, où, hélas, il retrouva la méchante femme.",0
"Pourtant, les conséquences de la mise en place de telles pratiques de gestion permettent de s'interroger sur les raisons véritables qui poussent une entreprise à évaluer ses connaissances",0
"Ainsi l'abbé Blanès n'avait pas communiqué sa science assez difficile à Fabrice ; mais, à son insu, il lui avait inoculé une confiance illimitée dans les signes qui peuvent prédire l'avenir.",0
"La 9e conférence des Nations unies sur le climat s'est achevée hier, dans une ambiance mi-figue, mi-raisin.",0
"OK, alors on se tient au courant pour samedi prochain ?",0
"Le Falcon 1 est un lanceur théoriquement réutilisable qui peut placer, selon son constructeur, 670 kg en orbite basse.",0
Le gâteau est dans le frigo.,0
"Née de la contraction anglaise de ""no-mobile phobia"", la nomophobie est, en simplifiant, une crainte obsédante et continuelle, de ne pas avoir son smartphone en état de marche avec soi.",0
"Des grosses parts pour les guerriers et pour Zahor, des petites parts pour les femmes et les enfants et enfin les os pour les chiens.",0
Le chien de ma voisine fais beaucoup de bruit.,1
"La réussite professionnelle fait oublier l'âge, l'échec le rappelle, reconnaît-il.",0
"Des délires, il en a, l'artiste qui débarque d'Evry en Île-de-France avec un baccalauréat littéraire en poche",0
"Actuellement, les moyens alloués pour le suivi des populations sont en diminution, et l'observation systématique de toutes les communes (ou de toutes les zones) est remise en question ; dans ce contexte, il semble intéressant de procéder au suivi des populations à partir d'un découpage spatial spécifiquement dédié, plutôt que d'utiliser le maillage communal comme grille d'observation.",0
Je compte bien arriver dès huit heures.,0
"Il est un autre horizon qu'annoncent les biologistes : la sixième extinction des espèces, qui n'épargnera que les animaux d'élevage, propres à l'exploitation directe.",0
Il est peu probable que tu doives souvent arroser les plantes.,0
"Ce métier ne convient que pour un début de carrière, dans la vente, par exemple.",0
Ils chevauchent un coq à taille humaine.,0
Ils faisaient une grande fête à chaque année.,0
"Je ne sais quel instinct m'avertissait d'ailleurs de me défier de ces axiomes généraux si exempts de toute restriction, si purs de toute nuance.",0
Je t'appelerais dès que je reçois les documents,0
C'est le plat préféré de Manon,0
"Elle donne sur le jardin, vous y serez très bien.",1
La montée des valeurs humanistes est une réalité qui se poursuit et s'affirme.,0
Nous vous remercions de votre compréhension et nous vous souhaitons une excellente journée.,0
"Elle se déroule dans de nombreux pays, mais à des dates et avec des traditions différentes.",0
"Je suis allé voir où elle habite, sans rien dire à personne.",0
"Finalement, il est aussi question de scepticisme, réalisation du stoïcisme, et décriant l'être autre comme subjectif et remettant donc en cause son aspect véridique et absolu",0
"Pour moi, c'est pas du tout frustrant, je suis très content de partir en France et ça faisait très longtemps que j'avais envie de venir en Bretagne, donc pour moi, c'était une très bonne opportunité.",0
Je vais donner des numéros !,1
"Le gouvernement veut lutter contre la fraude dans la rénovation énergétique, notamment en renforçant les contrôles et en s'attaquant aux ""démarchages téléphoniques abusifs"".",0
"Plus que faire une visite, le promeneur remontera le temps et découvrira ainsi une partie de l'histoire de la région.",0
"En travaillant, je bois beaucoup de thé.",0
"Philae, qui s'est posé à l'ombre entre des rochers, a d'abord fonctionné avec une pile d'une durée de vie de 60 heures.",0
"Dans un premier temps, les locuteurs subissent une très forte pression - politique, sociale ou économique - pour parler la langue dominante.",0
"Elle est chanteuse, et elle est malienne.",1
"À cette époque, les conventions d'appellation modernes ne se sont pas encore développées en Europe.",0
Rien d'autre.,1
C'est chouette !,1
Il sortit vivement le téléphone et jeta un oeil sur l'écran avant de répondre.,0
La balle est partie.,1
"Aujourd'hui, c'est une tarte aux framboises avec de la confiture faite maison",0
